{
  "findings": [
    {
      "title": "DBML — construct expressiveness, MUST-criteria, licence, and generation profile",
      "summary": "Ten advanced constructs, each with a verdict drawn from the DBML language reference (docs.md), corroborated where noted by the CLI source and export golden-file tests:\n- Composite primary keys: expressible — `(col1, col2) [pk]` inside an `indexes{}` block.\n- JSON payload columns: expressible — column type is free text passed through to the target dialect (e.g. `json`/`jsonb`).\n- Enumerated string domains: expressible — dedicated `enum` block.\n- Several self-referencing FKs on one table: expressible — the Ref/relationship grammar has no rule barring the same table on both sides; corroborated only by a two-table (not three-on-one) parser test fixture, so the 'three at once' case for TASK_INSTANCE is inferred, not directly demonstrated.\n- Nullable FKs: expressible — column `null`/`not null` (default null) plus a `?` optional-side relationship modifier.\n- Multi-column UNIQUE: expressible — the same `indexes{}` block, `[unique]` setting on a parenthesized column tuple.\n- One-to-zero-or-one: expressible — the one-to-one operator `-` combined with the documented `?` optional-side modifier (no worked `-?` example, but a direct rule application).\n- Value constraint beyond type: expressible — a dedicated `checks{}` block and column-level `check:` setting; the constraint expression itself is opaque, dialect-specific SQL text that DBML does not parse.\n- Several logical schemas in one database: expressible — an arbitrary `schema_name` prefix on any table/enum/relationship, with no documented limit on count.\n- Cross-cutting `domain_id`-on-every-table convention: not-expressible by any built-in DBML mechanism; would require an external script against `@dbml/core`'s parsed model.\n\nMUST criteria: (1) plain-text/version-controlled/product-neutral — pass; the dialect choice is deferred to `dbml2sql`'s target flag, not baked into the source. (2) Validator exits non-zero on malformed input — fail: direct reading of `@dbml/cli`'s `export.ts` and `bin/dbml2sql.js` found no `process.exit` call on a `CompilerError`; `hasErrors` is computed but only suppresses a success message, so the process exits 0 by default even after logging errors. (3) SVG/PNG from an ephemeral Docker container with zero local install — fail: no official Docker image exists on Docker Hub or GHCR for `@dbml/cli`, `dbml-renderer`, or the `holistics/dbml` project itself (confirmed by direct registry query); the only images found are unofficial, single-tag, stale (2019/2023) third-party uploads. SVG is possible only via the unofficial third-party `dbml-renderer` CLI; PNG is not documented as an output format anywhere in either toolchain.\n\nLicence/governance: Apache-2.0 (LICENSE file, direct read, corroborated by GitHub's own detection); single-vendor governance under Holistics Software Pte Ltd, the same company behind the commercial dbdiagram.io/dbdocs.io products DBML feeds; no GOVERNANCE.md/MAINTAINERS.md. Not at risk of abandonment: near-daily releases through August 2026 (v10.1.1 the same day as retrieval).\n\nGeneration/views/DDL: DBML has a real, named, language-level `DiagramView` construct (Tables/Notes/TableGroups/Schemas categories) — the closest analogue among all seven candidates to a Structurizr-style named subset view — but whether any open-source renderer actually honours it when producing an image was not confirmed. No official application-type generator exists (Pydantic/SQLAlchemy); the only lead found, `dbml-builder` on PyPI, is unofficial and unaffiliated. DDL derivation via `dbml2sql` is strong and directly confirmed by the project's own golden-file exporter tests for composite PKs, JSON columns, enums, nullable FKs, and CHECK constraints; self-referencing-FK, multi-column-UNIQUE, and one-to-one-uniqueness survival through DDL generation specifically were not found demonstrated in any examined fixture (a gap, not a confirmed failure).",
      "source_record_refs": [
        "sources/source-dbml-grammar.json",
        "sources/source-dbml-generation.json",
        "sources/source-dbml-tooling.json",
        "sources/source-dbml-docker-registry.json",
        "sources/source-dbml-licence-governance.json",
        "sources/source-dbml-contrary-evidence.json"
      ]
    },
    {
      "title": "Mermaid erDiagram (incumbent baseline) — construct expressiveness, MUST-criteria, licence, and generation profile",
      "summary": "Ten advanced constructs, verdicts drawn from the erDiagram grammar (erDiagram.jison, erDb.ts) and the official syntax reference, as of Mermaid v11.16.1:\n- Composite primary keys: expressible-only-via-workaround — PK is a per-attribute label only; two rows each marked PK render as two independent key flags, with no composite semantic, confirmed at both grammar and documentation level.\n- JSON payload columns: expressible — the type token is unstructured free text.\n- Enumerated string domains: expressible-only-via-workaround — no enum/domain keyword exists; only an unparsed, unenforced double-quoted comment could carry the value set.\n- Several self-referencing FKs on one table: expressible — the grammar/DB layer (`erDb.ts` addRelationship/addEntity) places no restriction on entA===entB or on repeated self-references.\n- Nullable FKs: expressible — as of v11.16.0 (2026-06-29), a `?` suffix on the type token marks an attribute optional/nullable — a recent addition.\n- Multi-column UNIQUE: expressible-only-via-workaround — UK is a per-attribute label like PK, with no grouping mechanism.\n- One-to-zero-or-one: expressible — the documented two-character cardinality markers (`||--o|`) directly support it.\n- Value constraint beyond type: expressible-only-via-workaround — only the unparsed comment field could carry it.\n- Several logical schemas in one database: not-expressible — no schema/namespace/grouping production exists in the erDiagram grammar (class diagrams have a separate namespace keyword erDiagram does not share).\n- Cross-cutting domain_id convention: not-expressible — `erDb.ts` is a pure structure-builder with no rule-evaluation logic; would require an entirely external script against the raw `.mmd` text.\n\nThe single most consequential finding for Mermaid as the incumbent under replacement: direct reading of `erDb.ts`'s `addEntity`/`addRelationship` shows that a relationship statement naming a previously undeclared entity is NOT rejected — it is silently auto-vivified into a new, attribute-less entity and rendered as though intentional. Mermaid's ER parser has no semantic-consistency check at all, only lexical/grammatical syntax checking.\n\nReading the actual in-repo incumbent artifact (docs/spec/supplementary_specs/entity-model.md) confirms this gap is not merely theoretical: only JSON payload columns and the one-to-zero-or-one relationship are fully expressed inside the diagram itself. Enumerated domains, nullable FKs, multi-column UNIQUE, and the value-constraint-beyond-type construct are carried ONLY in prose beneath the diagram — e.g. FOLDER_RUN.execution_context is typed plain 'string' in the diagram, with its SCHEDULED|MANUAL domain stated only in prose. Several logical schemas and the domain_id convention appear nowhere in the artifact, diagram or prose.\n\nMUSTs: (1) plain-text/version-controlled — pass; product-neutral — pass (no dialect-specific typing required). (2) Validator exits non-zero — fail: `mmdc` has no dedicated validate/lint subcommand; the only `process.exit(1)` calls found in `src/index.js` are for CLI-usage mistakes (missing file, wrong extension), not a parse/render failure; and, per the semantic finding above, a semantically inconsistent diagram does not fail at all — it renders 'successfully'. (3) SVG/PNG from an ephemeral Docker container, zero local install — pass: the official `minlag/mermaid-cli` image is actively published and current (pushed 2026-08-03), and SVG/PNG are both documented, first-class `-o` output formats.\n\nLicence/governance: MIT (mermaid core, copyright Knut Sveidqvist; mermaid-cli carries its own, separate MIT copyright, Tyler Long). No GOVERNANCE.md; maintainer-review-plus-named-release-authority (knsv 'in charge of the release process'), neither foundation-governed nor documented as single-vendor-commercial (no company is named as controlling mermaid-js/mermaid core, distinct from the separate commercial 'Mermaid Chart' entity that sponsors some maintainers but is not documented as controlling governance). Freshest-looking candidate by construction, being the incumbent in active use: core pushed 2026-08-14 (day of research), latest release 2026-08-04; mermaid-cli pushed 2026-08-10, latest release 2026-06-29.\n\nGeneration/views/DDL: no named-subset-view construct exists for erDiagram. No application-type generation of any kind; DDL derivation not applicable (no generation path exists to build it on).",
      "source_record_refs": [
        "sources/source-mermaid-erd-grammar.json",
        "sources/source-mermaid-erd-syntax.json",
        "sources/source-mermaid-erd-tooling.json",
        "sources/source-mermaid-erd-docker-registry.json",
        "sources/source-mermaid-erd-licence-governance.json",
        "sources/source-mermaid-erd-incumbent-artifact.json"
      ]
    },
    {
      "title": "LinkML — construct expressiveness, MUST-criteria, licence, and generation profile",